"DESCRIPTION","DURATION IN MS","NAME","PARENT SUITE","START TIME","STATUS","STOP TIME","SUB SUITE","SUITE","TEST CLASS","TEST METHOD"
"","2","Application compiles successfully","","Fri Dec 05 19:20:07 UTC 2025","passed","Fri Dec 05 19:20:07 UTC 2025","","Smoke Tests","org.example.SmokeTest","applicationCompiles"
"Должен возвращать правильное количество чётных чисел","1","Правильное количество чётных чисел","","Fri Dec 05 19:20:07 UTC 2025","passed","Fri Dec 05 19:20:07 UTC 2025","","Задача 3: Тесты фильтра чётных чисел","org.example.tasks.Task3EvenNumberFilterTest","testEvenNumbersCount"
"Должен возвращать только чётные числа","3","Все возвращённые числа чётные","","Fri Dec 05 19:20:07 UTC 2025","passed","Fri Dec 05 19:20:07 UTC 2025","","Задача 3: Тесты фильтра чётных чисел","org.example.tasks.Task3EvenNumberFilterTest","testAllNumbersAreEven"
"Должен сохранять порядок чётных чисел","2","Сохранение порядка","","Fri Dec 05 19:20:07 UTC 2025","passed","Fri Dec 05 19:20:07 UTC 2025","","Задача 3: Тесты фильтра чётных чисел","org.example.tasks.Task3EvenNumberFilterTest","testMaintainOrder"
"Должен фильтровать чётные числа из массива [1,2,3,4,5,6,7,8,9,10]","167","Фильтрация чётных чисел из заданного массива","","Fri Dec 05 19:20:07 UTC 2025","passed","Fri Dec 05 19:20:07 UTC 2025","","Задача 3: Тесты фильтра чётных чисел","org.example.tasks.Task3EvenNumberFilterTest","testFilterEvenNumbers"
